{
  "model_version": "0.1.0",
  "model_family": "inc15c6g-ogc-publisher-hierarchy",
  "retained_source_document": "2026-19903",
  "retained_pdf_original_receipt_path": "evidence/hhs-ogc-2026-statement/receipts/git-custody.json",
  "retained_publisher_url": "https://www.govinfo.gov/content/pkg/FR-2026-09-29/pdf/2026-19903.pdf",
  "source_publication_date": "2026-09-29",
  "independently_qualified_effective_date": null,
  "current_HHS_first_level_legal_denominator": null,
  "OGC_current_canonical_source_reference": "INC15C3-HHS-LINK-OGC",
  "OGC_division_count": 11,
  "OGC_immediate_office_count": 1,
  "OLR_office_count": 1,
  "OLR_named_branch_count": 6,
  "immediate_legislation_section_count": 1,
  "other_nested_division_group_branch_section_count": 19,
  "named_component_rows_total": 39,
  "group_branch_section_and_division_counts_nonadditive": true,
  "published_satellite_offices_are_not_independent_components": true,
  "independent_FDA_administrative_housing_not_separate_OGC_division": true,
  "legal_organization_root_bounded_to_OGC": true,
  "new_canonical_federal_institutions_minted": 0,
  "items": [
    {
      "id": "INC15C6G-OGC-IMM",
      "edition_local_code": "IMM",
      "publisher_source_label": "Immediate Office of the General Counsel",
      "publisher_structural_type": "immediate_office",
      "parent_edition_local_id": "INC15C3-HHS-LINK-OGC",
      "parent_is_existing_HHS_canonical_OGC": true,
      "source_section_locator": "II.A.1",
      "source_printed_page_locator": "61422-61423",
      "publisher_lead_role_text": "General Counsel",
      "publisher_order_in_transcription": 1,
      "document_number": "2026-19903",
      "published_on": "2026-09-29",
      "legal_effective_date": null,
      "organization_source_status": "published_OGC_restatement_effective_date_unqualified",
      "source_scoped_Ogc_component_only": true,
      "new_canonical_HHS_institution_id": null,
      "satellite_duty_location": false,
      "identified_officeholder_name": null,
      "independent_role_appointment_and_delegation_verified": false,
      "cross_HHS_supervisory_command_inferred": false
    },
    {
      "id": "INC15C6G-OGC-OLR",
      "edition_local_code": "OLR",
      "publisher_source_label": "Office of Legal Resources",
      "publisher_structural_type": "resources_office",
      "parent_edition_local_id": "INC15C6G-OGC-IMM",
      "parent_is_existing_HHS_canonical_OGC": false,
      "source_section_locator": "II.A.3",
      "source_printed_page_locator": "61423",
      "publisher_lead_role_text": "Director, Office of Legal Resources",
      "publisher_order_in_transcription": 2,
      "document_number": "2026-19903",
      "published_on": "2026-09-29",
      "legal_effective_date": null,
      "organization_source_status": "published_OGC_restatement_effective_date_unqualified",
      "source_scoped_Ogc_component_only": true,
      "new_canonical_HHS_institution_id": null,
      "satellite_duty_location": false,
      "identified_officeholder_name": null,
      "independent_role_appointment_and_delegation_verified": false,
      "cross_HHS_supervisory_command_inferred": false
    },
    {
      "id": "INC15C6G-OGC-OLR-BUD",
      "edition_local_code": "OLR-BUD",
      "publisher_source_label": "Budget",
      "publisher_structural_type": "branch",
      "parent_edition_local_id": "INC15C6G-OGC-OLR",
      "parent_is_existing_HHS_canonical_OGC": false,
      "source_section_locator": "II.A.3.a",
      "source_printed_page_locator": "61423",
      "publisher_lead_role_text": "Director or Manager",
      "publisher_order_in_transcription": 3,
      "document_number": "2026-19903",
      "published_on": "2026-09-29",
      "legal_effective_date": null,
      "organization_source_status": "published_OGC_restatement_effective_date_unqualified",
      "source_scoped_Ogc_component_only": true,
      "new_canonical_HHS_institution_id": null,
      "satellite_duty_location": false,
      "identified_officeholder_name": null,
      "independent_role_appointment_and_delegation_verified": false,
      "cross_HHS_supervisory_command_inferred": false
    },
    {
      "id": "INC15C6G-OGC-OLR-CORR",
      "edition_local_code": "OLR-CORR",
      "publisher_source_label": "Correspondence",
      "publisher_structural_type": "branch",
      "parent_edition_local_id": "INC15C6G-OGC-OLR",
      "parent_is_existing_HHS_canonical_OGC": false,
      "source_section_locator": "II.A.3.b",
      "source_printed_page_locator": "61423",
      "publisher_lead_role_text": "Director or Manager",
      "publisher_order_in_transcription": 4,
      "document_number": "2026-19903",
      "published_on": "2026-09-29",
      "legal_effective_date": null,
      "organization_source_status": "published_OGC_restatement_effective_date_unqualified",
      "source_scoped_Ogc_component_only": true,
      "new_canonical_HHS_institution_id": null,
      "satellite_duty_location": false,
      "identified_officeholder_name": null,
      "independent_role_appointment_and_delegation_verified": false,
      "cross_HHS_supervisory_command_inferred": false
    },
    {
      "id": "INC15C6G-OGC-OLR-HCS",
      "edition_local_code": "OLR-HCS",
      "publisher_source_label": "Human Capital Services",
      "publisher_structural_type": "branch",
      "parent_edition_local_id": "INC15C6G-OGC-OLR",
      "parent_is_existing_HHS_canonical_OGC": false,
      "source_section_locator": "II.A.3.c",
      "source_printed_page_locator": "61423",
      "publisher_lead_role_text": "Director or Manager",
      "publisher_order_in_transcription": 5,
      "document_number": "2026-19903",
      "published_on": "2026-09-29",
      "legal_effective_date": null,
      "organization_source_status": "published_OGC_restatement_effective_date_unqualified",
      "source_scoped_Ogc_component_only": true,
      "new_canonical_HHS_institution_id": null,
      "satellite_duty_location": false,
      "identified_officeholder_name": null,
      "independent_role_appointment_and_delegation_verified": false,
      "cross_HHS_supervisory_command_inferred": false
    },
    {
      "id": "INC15C6G-OGC-OLR-IT",
      "edition_local_code": "OLR-IT",
      "publisher_source_label": "Information Technology",
      "publisher_structural_type": "branch",
      "parent_edition_local_id": "INC15C6G-OGC-OLR",
      "parent_is_existing_HHS_canonical_OGC": false,
      "source_section_locator": "II.A.3.d",
      "source_printed_page_locator": "61423",
      "publisher_lead_role_text": "Director or Manager",
      "publisher_order_in_transcription": 6,
      "document_number": "2026-19903",
      "published_on": "2026-09-29",
      "legal_effective_date": null,
      "organization_source_status": "published_OGC_restatement_effective_date_unqualified",
      "source_scoped_Ogc_component_only": true,
      "new_canonical_HHS_institution_id": null,
      "satellite_duty_location": false,
      "identified_officeholder_name": null,
      "independent_role_appointment_and_delegation_verified": false,
      "cross_HHS_supervisory_command_inferred": false
    },
    {
      "id": "INC15C6G-OGC-OLR-LI",
      "edition_local_code": "OLR-LI",
      "publisher_source_label": "Legal Information",
      "publisher_structural_type": "branch",
      "parent_edition_local_id": "INC15C6G-OGC-OLR",
      "parent_is_existing_HHS_canonical_OGC": false,
      "source_section_locator": "II.A.3.e",
      "source_printed_page_locator": "61423",
      "publisher_lead_role_text": "Director or Manager",
      "publisher_order_in_transcription": 7,
      "document_number": "2026-19903",
      "published_on": "2026-09-29",
      "legal_effective_date": null,
      "organization_source_status": "published_OGC_restatement_effective_date_unqualified",
      "source_scoped_Ogc_component_only": true,
      "new_canonical_HHS_institution_id": null,
      "satellite_duty_location": false,
      "identified_officeholder_name": null,
      "independent_role_appointment_and_delegation_verified": false,
      "cross_HHS_supervisory_command_inferred": false
    },
    {
      "id": "INC15C6G-OGC-OLR-PPP",
      "edition_local_code": "OLR-PPP",
      "publisher_source_label": "Procurement, Policy and Planning",
      "publisher_structural_type": "branch",
      "parent_edition_local_id": "INC15C6G-OGC-OLR",
      "parent_is_existing_HHS_canonical_OGC": false,
      "source_section_locator": "II.A.3.f",
      "source_printed_page_locator": "61423",
      "publisher_lead_role_text": "Director or Manager",
      "publisher_order_in_transcription": 8,
      "document_number": "2026-19903",
      "published_on": "2026-09-29",
      "legal_effective_date": null,
      "organization_source_status": "published_OGC_restatement_effective_date_unqualified",
      "source_scoped_Ogc_component_only": true,
      "new_canonical_HHS_institution_id": null,
      "satellite_duty_location": false,
      "identified_officeholder_name": null,
      "independent_role_appointment_and_delegation_verified": false,
      "cross_HHS_supervisory_command_inferred": false
    },
    {
      "id": "INC15C6G-OGC-GCL",
      "edition_local_code": "GCL",
      "publisher_source_label": "Legislation Section",
      "publisher_structural_type": "section",
      "parent_edition_local_id": "INC15C6G-OGC-IMM",
      "parent_is_existing_HHS_canonical_OGC": false,
      "source_section_locator": "II.A.4",
      "source_printed_page_locator": "61423",
      "publisher_lead_role_text": "Senior Counsel for Legislation",
      "publisher_order_in_transcription": 9,
      "document_number": "2026-19903",
      "published_on": "2026-09-29",
      "legal_effective_date": null,
      "organization_source_status": "published_OGC_restatement_effective_date_unqualified",
      "source_scoped_Ogc_component_only": true,
      "new_canonical_HHS_institution_id": null,
      "satellite_duty_location": false,
      "identified_officeholder_name": null,